{
  "version":"2.0","cardId":"golden-08","name":"Filter map join chain",
  "protocol":[{"version":"v0.9","updateComponents":{"surfaceId":"default","components":[{"id":"names","component":"Text","text":{"path":"/open_names"}}]}},{"version":"v0.9","updateDataModel":{"surfaceId":"default","path":"/","value":{}}}],
  "dataSources":[{"id":"ds-1","endpoint":"http://127.0.0.1:18094/case08","method":"GET","role":"primary","itemsPath":"$.items","entityKey":"id"}],
  "bindings":[{"slotId":"names.field","dataSourceId":"ds-1","fieldPath":"$.items[*]","refKey":"/open_names","missingPolicy":"block","transforms":[{"operatorVersionId":405,"params":{"field":"status","value":"open"}},{"operatorVersionId":406,"params":{"field":"name"}},{"operatorVersionId":401,"params":{"separator":","}}]}],
  "operators":[
    {"operatorVersionId":405,"operatorKey":"agenui.list.filter","version":1,"inputSchema":{"type":"array","items":{"type":"object"}},"paramsSchema":{"type":"object","required":["field","value"],"properties":{"field":{"type":"string"},"value":{}},"additionalProperties":false},"outputSchema":{"type":"array","items":{"type":"object"}},"sourceHash":"sha256:dd29d1fe17efc6327a49f87776ceca310080adfa74336494c50d747555212f64","language":"javascript","entry":"run","sourceCode":"function run(values, params) { return values.filter(function(v) { return v[params.field] === params.value; }); }"},
    {"operatorVersionId":406,"operatorKey":"agenui.list.map","version":1,"inputSchema":{"type":"array","items":{"type":"object"}},"paramsSchema":{"type":"object","required":["field"],"properties":{"field":{"type":"string"}},"additionalProperties":false},"outputSchema":{"type":"array"},"sourceHash":"sha256:dae5883fc2620e86f42c5284c12528cc82331103dd21d3a65abe613454a9edaf","language":"javascript","entry":"run","sourceCode":"function run(values, params) { return values.map(function(v) { return v[params.field]; }); }"},
    {"operatorVersionId":401,"operatorKey":"agenui.list.join","version":1,"inputSchema":{"type":"array","items":{"type":"string"}},"paramsSchema":{"type":"object","properties":{"separator":{"type":"string"}},"additionalProperties":false},"outputSchema":{"type":"string"},"sourceHash":"sha256:db756221fe52e3688230c9abe4057862d884e002056fe86b61924c1c4b7500fb","language":"javascript","entry":"run","sourceCode":"function run(values, params) { return values.map(function(v) { return params.field ? v[params.field] : v; }).join(params.separator || \" | \"); }"}
  ],
  "meta":{"contractHash":"sha256:1111111111111111111111111111111111111111111111111111111111111111","designHash":"sha256:2222222222222222222222222222222222222222222222222222222222222222","requirementsHash":"sha256:3333333333333333333333333333333333333333333333333333333333333333"}
}
